"Feature Name","Feature Description",Industry,Usecase,Source
stdpayback30,"standard deviation of payback time in days over last 30 days",telecommunication,"telco-based credit scoring",https://www.researchgate.net/publication/330266004_Effective_credit_scoring_using_limited_mobile_phone_data
days_consecutive_borrow,"average number of days between two consecutive borrowing",telecommunication,"telco-based credit scoring",https://www.researchgate.net/publication/330266004_Effective_credit_scoring_using_limited_mobile_phone_data
speed,"Average, minimum, maximum and standard deviation of speed",telecommunication,"transportation model detection",https://www.researchgate.net/profile/Ajinkya-Ghorpade/publication/275949958_An_integrated_stop-mode_detection_algorithm_for_real_world_smartphone-based_travel_survey/links/554a281a0cf29f836c95d9c6/An-integrated-stop-mode-detection-algorithm-for-real-world-smartphone-based-travel-survey.pdf
"latitude, longitude","Average, minimum, maximum and standard deviation of geographical distance between each location reading and the centroid of location points",telecommunication,"transportation model detection",https://www.researchgate.net/profile/Ajinkya-Ghorpade/publication/275949958_An_integrated_stop-mode_detection_algorithm_for_real_world_smartphone-based_travel_survey/links/554a281a0cf29f836c95d9c6/An-integrated-stop-mode-detection-algorithm-for-real-world-smartphone-based-travel-survey.pdf
"accelerometer magnitude(fa)","Average, minimum, maximum, standard deviation,
coefficient of variance, interquantile range of frequency",telecommunication,"transportation model detection",https://www.researchgate.net/profile/Ajinkya-Ghorpade/publication/275949958_An_integrated_stop-mode_detection_algorithm_for_real_world_smartphone-based_travel_survey/links/554a281a0cf29f836c95d9c6/An-integrated-stop-mode-detection-algorithm-for-real-world-smartphone-based-travel-survey.pdf
"validated stops/modes","Minimum and average distance and density",telecommunication,"transportation model detection",https://www.researchgate.net/profile/Ajinkya-Ghorpade/publication/275949958_An_integrated_stop-mode_detection_algorithm_for_real_world_smartphone-based_travel_survey/links/554a281a0cf29f836c95d9c6/An-integrated-stop-mode-detection-algorithm-for-real-world-smartphone-based-travel-survey.pdf
"deleted stops/modes","Minimum and average distance and density",telecommunication,"transportation model detection",https://www.researchgate.net/profile/Ajinkya-Ghorpade/publication/275949958_An_integrated_stop-mode_detection_algorithm_for_real_world_smartphone-based_travel_survey/links/554a281a0cf29f836c95d9c6/An-integrated-stop-mode-detection-algorithm-for-real-world-smartphone-based-travel-survey.pdf
wi-fi,"Common wi-fi access points",telecommunication,"transportation model detection",https://www.researchgate.net/profile/Ajinkya-Ghorpade/publication/275949958_An_integrated_stop-mode_detection_algorithm_for_real_world_smartphone-based_travel_survey/links/554a281a0cf29f836c95d9c6/An-integrated-stop-mode-detection-algorithm-for-real-world-smartphone-based-travel-survey.pdf
"bus/train network data","Common bus/train line",telecommunication,"transportation model detection",https://www.researchgate.net/profile/Ajinkya-Ghorpade/publication/275949958_An_integrated_stop-mode_detection_algorithm_for_real_world_smartphone-based_travel_survey/links/554a281a0cf29f836c95d9c6/An-integrated-stop-mode-detection-algorithm-for-real-world-smartphone-based-travel-survey.pdf
"service set identifiers (ssid's)","For android devices, Service Set Identifiers (SSID's) for all the wifi access points within scanning range of the device are recorded every minute",telecommunication,"transportation model detection",https://www.researchgate.net/profile/Ajinkya-Ghorpade/publication/275949958_An_integrated_stop-mode_detection_algorithm_for_real_world_smartphone-based_travel_survey/links/554a281a0cf29f836c95d9c6/An-integrated-stop-mode-detection-algorithm-for-real-world-smartphone-based-travel-survey.pdf
"gis features","Information about bus and train stops and routes(Parking, Bus Stop, Train Stop, Shops, Recreation, Eating place, Education, Amenities,Religious, Health, Taxi, Train route, Bus route)",telecommunication,"transportation model detection",https://www.researchgate.net/profile/Ajinkya-Ghorpade/publication/275949958_An_integrated_stop-mode_detection_algorithm_for_real_world_smartphone-based_travel_survey/links/554a281a0cf29f836c95d9c6/An-integrated-stop-mode-detection-algorithm-for-real-world-smartphone-based-travel-survey.pdf
poi,"points of interests (POI) to represent GIS information. density of POIs and minimum and average distance from each type of POI within the radius r of a segment",telecommunication,"transportation model detection",https://www.researchgate.net/profile/Ajinkya-Ghorpade/publication/275949958_An_integrated_stop-mode_detection_algorithm_for_real_world_smartphone-based_travel_survey/links/554a281a0cf29f836c95d9c6/An-integrated-stop-mode-detection-algorithm-for-real-world-smartphone-based-travel-survey.pdf
"network location","GPS or GSM/Wifi",telecommunication,"transportation model detection",https://www.researchgate.net/profile/Ajinkya-Ghorpade/publication/275949958_An_integrated_stop-mode_detection_algorithm_for_real_world_smartphone-based_travel_survey/links/554a281a0cf29f836c95d9c6/An-integrated-stop-mode-detection-algorithm-for-real-world-smartphone-based-travel-survey.pdf
"physical motion of a solid object","the acceleration force that is applied to a device on all three physical axes",telecommunication,"transportation model detection",https://infoscience.epfl.ch/record/229181
"device's rate of rotation","Gyroscope measures a device's rate of rotation around each of the three physical axes. It can provide orientation information, and provides an additional dimension to the information supplied by the accelerometer",telecommunication,"transportation model detection",https://infoscience.epfl.ch/record/229181
"geomagnetic field","Magnetometer measures the ambient geomagnetic field for all three physical axes. It provides mobile phones with a simple orientation in relation to the Earth's magnetic field",telecommunication,"transportation model detection",https://infoscience.epfl.ch/record/229181
"cellular network signals","The fluctuation pattern of cell identifiers together with signal strength can provide information on the position of a phone.",telecommunication,"transportation model detection",https://infoscience.epfl.ch/record/229181
"user's position and velocity","current location and velocity of user(can be find using cellular network signals)",telecommunication,"transportation model detection",https://infoscience.epfl.ch/record/229181
"blutooth related features","Bluetooth identifiers, names and types of devices in their vicinity",telecommunication,"transportation model detection",https://infoscience.epfl.ch/record/229181
arpu,"Average revenue per user","banking financial service and insurance","financial statement fraud detection",https://www.sciencedirect.com/science/article/abs/pii/S0950705117302022
assets,"total assets","banking financial service and insurance","financial statement fraud detection",https://www.sciencedirect.com/science/article/abs/pii/S0950705117302022
ih,"shares held by mutual funds","banking financial service and insurance","financial statement fraud detection",https://www.sciencedirect.com/science/article/abs/pii/S0950705117302022
inh,"shares held by insiders","banking financial service and insurance","financial statement fraud detection",https://www.sciencedirect.com/science/article/abs/pii/S0950705117302022
ni,"net income","banking financial service and insurance","financial statement fraud detection",https://www.sciencedirect.com/science/article/abs/pii/S0950705117302022
ni/r,"net income to revenues","banking financial service and insurance","financial statement fraud detection",https://www.sciencedirect.com/science/article/abs/pii/S0950705117302022
nm,"net margin","banking financial service and insurance","financial statement fraud detection",https://www.sciencedirect.com/science/article/abs/pii/S0950705117302022
om,"operating margin","banking financial service and insurance","financial statement fraud detection",https://www.sciencedirect.com/science/article/abs/pii/S0950705117302022
roe,"return on equity","banking financial service and insurance","financial statement fraud detection",https://www.sciencedirect.com/science/article/abs/pii/S0950705117302022
roa,"return on assets","banking financial service and insurance","financial statement fraud detection",https://www.sciencedirect.com/science/article/abs/pii/S0950705117302022
ev/ebit,"enterprise value to earnings before interest and taxes","banking financial service and insurance","financial statement fraud detection",https://www.sciencedirect.com/science/article/abs/pii/S0950705117302022
ev/ebitda,"enterprise value to earnings before interest, taxes, depreciation and amortization","banking financial service and insurance","financial statement fraud detection",https://www.sciencedirect.com/science/article/abs/pii/S0950705117302022
"ncwc gr","growth in NCWC","banking financial service and insurance","financial statement fraud detection",https://www.sciencedirect.com/science/article/abs/pii/S0950705117302022
ta/r,"total assets to revenues","banking financial service and insurance","financial statement fraud detection",https://www.sciencedirect.com/science/article/abs/pii/S0950705117302022
cash/r,"cash to revenues","banking financial service and insurance","financial statement fraud detection",https://www.sciencedirect.com/science/article/abs/pii/S0950705117302022
ncwc/r,"non-cash working capital to revenues","banking financial service and insurance","financial statement fraud detection",https://www.sciencedirect.com/science/article/abs/pii/S0950705117302022
fa/ta,"fixed assets to total assets","banking financial service and insurance","financial statement fraud detection",https://www.sciencedirect.com/science/article/abs/pii/S0950705117302022
"r gr","growth in revenues last year","banking financial service and insurance","financial statement fraud detection",https://www.sciencedirect.com/science/article/abs/pii/S0950705117302022
"r exp","expect. growth in revenues (next 5 years)","banking financial service and insurance","financial statement fraud detection",https://www.sciencedirect.com/science/article/abs/pii/S0950705117302022
sgae/r,"SG&A expenditures to revenues","banking financial service and insurance","financial statement fraud detection",https://www.sciencedirect.com/science/article/abs/pii/S0950705117302022
ncwc,"non-cash working capital","banking financial service and insurance","financial statement fraud detection",https://www.sciencedirect.com/science/article/abs/pii/S0950705117302022
bd/ta,"book debt to total assets","banking financial service and insurance","financial statement fraud detection",https://www.sciencedirect.com/science/article/abs/pii/S0950705117302022
div/p,"beta regression coefficient (3 year)","banking financial service and insurance","financial statement fraud detection",https://www.sciencedirect.com/science/article/abs/pii/S0950705117302022
eps,"dividends to stock price","banking financial service and insurance","financial statement fraud detection",https://www.sciencedirect.com/science/article/abs/pii/S0950705117302022
"eps gr","earnings per share growth in earnings per share (last 5 years)","banking financial service and insurance","financial statement fraud detection",https://www.sciencedirect.com/science/article/abs/pii/S0950705117302022
"eps exp","expected growth in EPS (next 5 years)","banking financial service and insurance","financial statement fraud detection",https://www.sciencedirect.com/science/article/abs/pii/S0950705117302022
p/e,"stock price to earnings","banking financial service and insurance","financial statement fraud detection",https://www.sciencedirect.com/science/article/abs/pii/S0950705117302022
peg,"stock price to earnings to EPS growth","banking financial service and insurance","financial statement fraud detection",https://www.sciencedirect.com/science/article/abs/pii/S0950705117302022
pbv,"price to book value ratio","banking financial service and insurance","financial statement fraud detection",https://www.sciencedirect.com/science/article/abs/pii/S0950705117302022
rr,"reinvestment rate","banking financial service and insurance","financial statement fraud detection",https://www.sciencedirect.com/science/article/abs/pii/S0950705117302022
ps,"stock price to sales","banking financial service and insurance","financial statement fraud detection",https://www.sciencedirect.com/science/article/abs/pii/S0950705117302022
close/last,"Stock price at the closing of the trading day","banking financial service and insurance","stock price prediction",https://www.kaggle.com/faressayah/stock-market-analysis-prediction-using-lstm/data
volume,"Number of shares traded during the trading day","banking financial service and insurance","stock price prediction",https://www.kaggle.com/faressayah/stock-market-analysis-prediction-using-lstm/data
open,"Stock price at the opening of the trading day","banking financial service and insurance","stock price prediction",https://www.kaggle.com/faressayah/stock-market-analysis-prediction-using-lstm/data
high,"Maximum stock price during the trading day","banking financial service and insurance","stock price prediction",https://www.kaggle.com/faressayah/stock-market-analysis-prediction-using-lstm/data
low,"Minimum stock price during the trading day","banking financial service and insurance","stock price prediction",https://www.kaggle.com/faressayah/stock-market-analysis-prediction-using-lstm/data
marital_status," is the client married (Yes, No)","banking financial service and insurance","recommender system",https://github.com/anshuljdhingra/Bank-Recommendation-Engine/blob/master/bank_recommendation.csv
gender,"Gender of the client","banking financial service and insurance","recommender system",https://github.com/anshuljdhingra/Bank-Recommendation-Engine/blob/master/bank_recommendation.csv
location,"Customer location including city and region","banking financial service and insurance","recommender system",https://github.com/anshuljdhingra/Bank-Recommendation-Engine/blob/master/bank_recommendation.csv
customer_country,"country of the customer","banking financial service and insurance","recommender system",https://github.com/anshuljdhingra/Bank-Recommendation-Engine/blob/master/bank_recommendation.csv
income,"annual income of customer","banking financial service and insurance","recommender system",https://github.com/anshuljdhingra/Bank-Recommendation-Engine/blob/master/bank_recommendation.csv
property_saving_insurance,"real estate/ building society savings agreement/life insurance/no property","banking financial service and insurance","recommender system",https://github.com/anshuljdhingra/Bank-Recommendation-Engine/blob/master/bank_recommendation.csv
foreign_worker_flag,yes/no,"banking financial service and insurance","recommender system",https://github.com/anshuljdhingra/Bank-Recommendation-Engine/blob/master/bank_recommendation.csv
employee_index,"Employee flag: Active, ex employed, filial, not employee, passive","banking financial service and insurance","recommender system",https://github.com/anshuljdhingra/Bank-Recommendation-Engine/blob/master/bank_recommendation.csv
new_customer,"New customer flag. 1 if the customer registered in the last 6 months.","banking financial service and insurance","recommender system",https://github.com/anshuljdhingra/Bank-Recommendation-Engine/blob/master/bank_recommendation.csv
relationship_months,"Customer seniority (in months)","banking financial service and insurance","recommender system",https://github.com/anshuljdhingra/Bank-Recommendation-Engine/blob/master/bank_recommendation.csv
relationship_flag,"1 (First/Primary), 99 (Primary customer during the month but not at the end of the month)","banking financial service and insurance","recommender system",https://github.com/anshuljdhingra/Bank-Recommendation-Engine/blob/master/bank_recommendation.csv
customer_type_begin_month,"Customer type at the beginning of the month ,1 (First/Primary customer), 2 (co-owner ),P (Potential),3 (former primary), 4(former co-owner)","banking financial service and insurance","recommender system",https://github.com/anshuljdhingra/Bank-Recommendation-Engine/blob/master/bank_recommendation.csv
cust_relation_type_begin_month,"Customer relation type at the beginning of the month, A (active), I (inactive), P (former customer),R (Potential)","banking financial service and insurance","recommender system",https://github.com/anshuljdhingra/Bank-Recommendation-Engine/blob/master/bank_recommendation.csv
residence_flag,"Residence flag Yes/No if the residence country is the same than the bank country","banking financial service and insurance","recommender system",https://github.com/anshuljdhingra/Bank-Recommendation-Engine/blob/master/bank_recommendation.csv
channel_when_joined,"channel used by the customer to join","banking financial service and insurance","recommender system",https://github.com/anshuljdhingra/Bank-Recommendation-Engine/blob/master/bank_recommendation.csv
deceased_flag,"Deceased flag. Yes/No","banking financial service and insurance","recommender system",https://github.com/anshuljdhingra/Bank-Recommendation-Engine/blob/master/bank_recommendation.csv
address_type,"Address type e.g. primary","banking financial service and insurance","recommender system",https://github.com/anshuljdhingra/Bank-Recommendation-Engine/blob/master/bank_recommendation.csv
customer_address,"segmentation: 01 - VIP, 02 - Individuals 03 - college graduated","banking financial service and insurance","recommender system",https://github.com/anshuljdhingra/Bank-Recommendation-Engine/blob/master/bank_recommendation.csv
activity_flag,"is the client active (1, 0)","banking financial service and insurance","recommender system",https://github.com/anshuljdhingra/Bank-Recommendation-Engine/blob/master/bank_recommendation.csv
gross_household_income,"Gross income of the household","banking financial service and insurance","recommender system",https://github.com/anshuljdhingra/Bank-Recommendation-Engine/blob/master/bank_recommendation.csv
segment,"particular Account","banking financial service and insurance","recommender system",https://github.com/anshuljdhingra/Bank-Recommendation-Engine/blob/master/bank_recommendation.csv
marital_status," is the client married (Yes, No)","banking financial service and insurance","recommender system",https://medium.com/@bhattbhavesh91/recommendation-system-implementation-for-dummies-9051508b4398
gender,"Gender of the client","banking financial service and insurance","recommender system",https://medium.com/@bhattbhavesh91/recommendation-system-implementation-for-dummies-9051508b4398
"loan status","Flag indicating whether the user paid back the credit amount within 5 days of issuing the loan{1:success, 0:failure}","banking financial service and insurance","recommender system",https://medium.com/@bhattbhavesh91/recommendation-system-implementation-for-dummies-9051508b4398
income,"annual income of customer","banking financial service and insurance","recommender system",https://medium.com/@bhattbhavesh91/recommendation-system-implementation-for-dummies-9051508b4398
education,"Users' education level","banking financial service and insurance","recommender system",https://medium.com/@bhattbhavesh91/recommendation-system-implementation-for-dummies-9051508b4398
job,"unemployed/unskilled - resident/skilled employee/management/highly qualified employee","banking financial service and insurance","recommender system",https://medium.com/@bhattbhavesh91/recommendation-system-implementation-for-dummies-9051508b4398
"total number of employees","the number of employees engaged at the place of business each regular working day during the preceding calendar year","banking financial service and insurance","recommender system",https://medium.com/@bhattbhavesh91/recommendation-system-implementation-for-dummies-9051508b4398
housing_loan_flag,"has housing loan ?","banking financial service and insurance","recommender system",https://medium.com/@bhattbhavesh91/recommendation-system-implementation-for-dummies-9051508b4398
personal_loan_flag,"has personal loan ?","banking financial service and insurance","recommender system",https://medium.com/@bhattbhavesh91/recommendation-system-implementation-for-dummies-9051508b4398
contact_communication_type,"contact communication type (cellular, telephone)","banking financial service and insurance","recommender system",https://medium.com/@bhattbhavesh91/recommendation-system-implementation-for-dummies-9051508b4398
last_contact_month,"last contact month of year","banking financial service and insurance","recommender system",https://medium.com/@bhattbhavesh91/recommendation-system-implementation-for-dummies-9051508b4398
last_contact_dow,"last contact day of the year","banking financial service and insurance","recommender system",https://medium.com/@bhattbhavesh91/recommendation-system-implementation-for-dummies-9051508b4398
last_contact_duration,"last contact durations in seconds","banking financial service and insurance","recommender system",https://medium.com/@bhattbhavesh91/recommendation-system-implementation-for-dummies-9051508b4398
compaign_number_contacts,"number of contacts performed during this campaign and for this client (numeric, includes last contact)","banking financial service and insurance","recommender system",https://medium.com/@bhattbhavesh91/recommendation-system-implementation-for-dummies-9051508b4398
pdays,"number of days that passed by after the client was last contacted from a previous campaign (numeric; 999 means client was not previously contacted)","banking financial service and insurance","recommender system",https://medium.com/@bhattbhavesh91/recommendation-system-implementation-for-dummies-9051508b4398
previous,"number of contacts performed before this campaign and for this client (numeric)","banking financial service and insurance","recommender system",https://medium.com/@bhattbhavesh91/recommendation-system-implementation-for-dummies-9051508b4398
poutcomes,"outcome of the previous marketing campaign (categorical: 'failure','nonexistent','success')","banking financial service and insurance","recommender system",https://medium.com/@bhattbhavesh91/recommendation-system-implementation-for-dummies-9051508b4398
emp.var.rate,"employment variation rate - quarterly indicator (numeric)","banking financial service and insurance","recommender system",https://medium.com/@bhattbhavesh91/recommendation-system-implementation-for-dummies-9051508b4398
cons.price.idx,"consumer price index - monthly indicator (numeric)","banking financial service and insurance","recommender system",https://medium.com/@bhattbhavesh91/recommendation-system-implementation-for-dummies-9051508b4398
cons.cond.idxx,"consumer confidence index - monthly indicator (numeric)","banking financial service and insurance","recommender system",https://medium.com/@bhattbhavesh91/recommendation-system-implementation-for-dummies-9051508b4398
euribor3m,"euribor 3 month rate - daily indicator (numeric)","banking financial service and insurance","recommender system",https://medium.com/@bhattbhavesh91/recommendation-system-implementation-for-dummies-9051508b4398
card_type,"Card type","banking financial service and insurance","recommender system",https://medium.com/learning-machine-learning/building-a-credit-card-recommender-and-deploying-on-web-and-chatbot-platform-91bd7baf2798
credit_limit,"Limit of Credit Card for user","banking financial service and insurance","recommender system",https://medium.com/learning-machine-learning/building-a-credit-card-recommender-and-deploying-on-web-and-chatbot-platform-91bd7baf2798
"card name","Name of the card","banking financial service and insurance","recommender system",https://medium.com/learning-machine-learning/building-a-credit-card-recommender-and-deploying-on-web-and-chatbot-platform-91bd7baf2798
"bank name","Name of the bank to which card is associated","banking financial service and insurance","recommender system",https://medium.com/learning-machine-learning/building-a-credit-card-recommender-and-deploying-on-web-and-chatbot-platform-91bd7baf2798
url,"URL of the bank credit card","banking financial service and insurance","recommender system",https://medium.com/learning-machine-learning/building-a-credit-card-recommender-and-deploying-on-web-and-chatbot-platform-91bd7baf2798
"interest rate","Interest rate on card","banking financial service and insurance","recommender system",https://medium.com/learning-machine-learning/building-a-credit-card-recommender-and-deploying-on-web-and-chatbot-platform-91bd7baf2798
cash_withdrawal_limit_per_trans,"Maximum limit of cash withdrawal per transactions","banking financial service and insurance","recommender system",https://medium.com/learning-machine-learning/building-a-credit-card-recommender-and-deploying-on-web-and-chatbot-platform-91bd7baf2798
cash_withdrawal_limit_per_day,"Maximum limit of cash withdrawal per day","banking financial service and insurance","recommender system",https://medium.com/learning-machine-learning/building-a-credit-card-recommender-and-deploying-on-web-and-chatbot-platform-91bd7baf2798
international_trans_available,"is there any international transaction service available","banking financial service and insurance","recommender system",https://medium.com/learning-machine-learning/building-a-credit-card-recommender-and-deploying-on-web-and-chatbot-platform-91bd7baf2798
