"Feature Name","Feature Description",Industry,Usecase,Source
"the recent level of sku-store sales in the absence of promotions","Calculated by using exponential smoothing on the sales of periods when the focal SKU was not promoted",retail,"sales prediction",https://www.researchgate.net/profile/Oezden-Ali/publication/258885715_Driver_Moderator_Method_for_Retail_Sales_Prediction/links/554a0a8c0cf2e859ce18b4e3/Driver-Moderator-Method-for-Retail-Sales-Prediction.pdf
"marketing mix variables for the sku-store","Include an indicator variable for whether the SKU is discounted, the discount percentage, and the number of promotions",retail,"sales prediction",https://www.researchgate.net/profile/Oezden-Ali/publication/258885715_Driver_Moderator_Method_for_Retail_Sales_Prediction/links/554a0a8c0cf2e859ce18b4e3/Driver-Moderator-Method-for-Retail-Sales-Prediction.pdf
"indices for the competitor promotion intensity in the category and the subcategory that the sku is in","Calculated as the average discount per- centage observed in the category or the subcategory, weighted by the historical shares of these products",retail,"sales prediction",https://www.researchgate.net/profile/Oezden-Ali/publication/258885715_Driver_Moderator_Method_for_Retail_Sales_Prediction/links/554a0a8c0cf2e859ce18b4e3/Driver-Moderator-Method-for-Retail-Sales-Prediction.pdf
"time invariant sku attributes","brand, size, price category, avor, store and subgroup",retail,"sales prediction",https://www.researchgate.net/profile/Oezden-Ali/publication/258885715_Driver_Moderator_Method_for_Retail_Sales_Prediction/links/554a0a8c0cf2e859ce18b4e3/Driver-Moderator-Method-for-Retail-Sales-Prediction.pdf
"time variant descriptors sku and category dynamics","category/subcategory size, SKU share of brand/category/subcategory, days since/into discount, frequency/ depth of discounts for SKU/category/brand, lags of sales, and marketing mix variables",retail,"sales prediction",https://www.researchgate.net/profile/Oezden-Ali/publication/258885715_Driver_Moderator_Method_for_Retail_Sales_Prediction/links/554a0a8c0cf2e859ce18b4e3/Driver-Moderator-Method-for-Retail-Sales-Prediction.pdf
"store and seasonality indicators","Indicators related to specific times of the year that try to predict year end stock market results",retail,"sales prediction",https://www.researchgate.net/profile/Oezden-Ali/publication/258885715_Driver_Moderator_Method_for_Retail_Sales_Prediction/links/554a0a8c0cf2e859ce18b4e3/Driver-Moderator-Method-for-Retail-Sales-Prediction.pdf
storeid,storeid,retail,"income prediction",https://core.ac.uk/download/pdf/286449835.pdf
"count of bus stations near the store","within a distance of 100, 200, 300, 400, 500 and 800 meters radially",retail,"income prediction",https://core.ac.uk/download/pdf/286449835.pdf
"count of residentials near the store","within a distance of 300 meters radially",retail,"income prediction",https://core.ac.uk/download/pdf/286449835.pdf
"average building age near the store","within a distance of 100 and 500 meters radially",retail,"income prediction",https://core.ac.uk/download/pdf/286449835.pdf
"count of transport stops near the store","within a distance of 300 meters radially",retail,"income prediction",https://core.ac.uk/download/pdf/286449835.pdf
"count of transport routes near the store","within a distance of 100 and 500 meters radially",retail,"income prediction",https://core.ac.uk/download/pdf/286449835.pdf
"count of metro stops near the store","within a distance of 300 meters radially",retail,"income prediction",https://core.ac.uk/download/pdf/286449835.pdf
"count of supermarkets near the store","within a distance of 300 meters radially",retail,"income prediction",https://core.ac.uk/download/pdf/286449835.pdf
"count of malls near the store","within a distance of 100 and 500 meters radially",retail,"income prediction",https://core.ac.uk/download/pdf/286449835.pdf
"count of pharmacies near the store","within a distance of 100 and 500 meters radially",retail,"income prediction",https://core.ac.uk/download/pdf/286449835.pdf
"count of competitors near the store","within a distance of 100 and 500 meters radially",retail,"income prediction",https://core.ac.uk/download/pdf/286449835.pdf
trans_date/time,"Transaction date/time",retail,"purchase prediction",https://arxiv.org/pdf/1408.6515.pdf
"user id","user id",retail,"purchase prediction",https://arxiv.org/pdf/1408.6515.pdf
"brand id","brand id",retail,"purchase prediction",https://arxiv.org/pdf/1408.6515.pdf
"action type","click, buy, collect, or cart",retail,"purchase prediction",https://arxiv.org/pdf/1408.6515.pdf
first_present_transaction_time,"Time shows the time gap between the first transaction and the following one.",healthcare,"cancer prediction",https://www.researchgate.net/profile/Sapiah_Sakri2/publication/325563712_Particle_Swarm_Optimization_Feature_Selection_for_Breast_Cancer_Recurrence_Prediction/links/5b9b27c392851ca9ed0645f7/Particle-Swarm-Optimization-Feature-Selection-for-Breast-Cancer-Recurrence-Prediction.pdf
"ID code number","Id Number",healthcare,"cancer prediction",https://www.researchgate.net/profile/Sapiah_Sakri2/publication/325563712_Particle_Swarm_Optimization_Feature_Selection_for_Breast_Cancer_Recurrence_Prediction/links/5b9b27c392851ca9ed0645f7/Particle-Swarm-Optimization-Feature-Selection-for-Breast-Cancer-Recurrence-Prediction.pdf
Outcome,"R = Recur, N = Non-recur",healthcare,"cancer prediction",https://www.researchgate.net/profile/Sapiah_Sakri2/publication/325563712_Particle_Swarm_Optimization_Feature_Selection_for_Breast_Cancer_Recurrence_Prediction/links/5b9b27c392851ca9ed0645f7/Particle-Swarm-Optimization-Feature-Selection-for-Breast-Cancer-Recurrence-Prediction.pdf
"Features Value #1-32","1 - 4 or 1 - 10",healthcare,"cancer prediction",https://www.researchgate.net/profile/Sapiah_Sakri2/publication/325563712_Particle_Swarm_Optimization_Feature_Selection_for_Breast_Cancer_Recurrence_Prediction/links/5b9b27c392851ca9ed0645f7/Particle-Swarm-Optimization-Feature-Selection-for-Breast-Cancer-Recurrence-Prediction.pdf
"Tumor size","The diameter of the excised tumor in centimeters",healthcare,"cancer prediction",https://www.researchgate.net/profile/Sapiah_Sakri2/publication/325563712_Particle_Swarm_Optimization_Feature_Selection_for_Breast_Cancer_Recurrence_Prediction/links/5b9b27c392851ca9ed0645f7/Particle-Swarm-Optimization-Feature-Selection-for-Breast-Cancer-Recurrence-Prediction.pdf
"Lymph node status","The number of positive axillary lymph nodes observed at the time of surgery",healthcare,"cancer prediction",https://www.researchgate.net/profile/Sapiah_Sakri2/publication/325563712_Particle_Swarm_Optimization_Feature_Selection_for_Breast_Cancer_Recurrence_Prediction/links/5b9b27c392851ca9ed0645f7/Particle-Swarm-Optimization-Feature-Selection-for-Breast-Cancer-Recurrence-Prediction.pdf
"Clump thickness","Thickness of Clump (1-10)",healthcare,"cancer prediction",https://pdfs.semanticscholar.org/08a6/c17e51ae3fa40cd37d46ec0187cb462bb2ec.pdf
"Uniformity of cell size","Uniformity of cell size (1-10)",healthcare,"cancer prediction",https://pdfs.semanticscholar.org/08a6/c17e51ae3fa40cd37d46ec0187cb462bb2ec.pdf
"Uniformity of cell shape","Uniformity of cell shape (1-10)",healthcare,"cancer prediction",https://pdfs.semanticscholar.org/08a6/c17e51ae3fa40cd37d46ec0187cb462bb2ec.pdf
"Marginal adhesion","Marginal adhesion (1-10)",healthcare,"cancer prediction",https://pdfs.semanticscholar.org/08a6/c17e51ae3fa40cd37d46ec0187cb462bb2ec.pdf
"Single epithelial cell size","Single epithelial cell size (1–10)",healthcare,"cancer prediction",https://pdfs.semanticscholar.org/08a6/c17e51ae3fa40cd37d46ec0187cb462bb2ec.pdf
"Bare nuclei","Bare nuclei (1–10)",healthcare,"cancer prediction",https://pdfs.semanticscholar.org/08a6/c17e51ae3fa40cd37d46ec0187cb462bb2ec.pdf
"Bland chromatin","Bland chromatin (1–10)",healthcare,"cancer prediction",https://pdfs.semanticscholar.org/08a6/c17e51ae3fa40cd37d46ec0187cb462bb2ec.pdf
"Normal nucleoli","Normal nucleoli (1–10)",healthcare,"cancer prediction",https://pdfs.semanticscholar.org/08a6/c17e51ae3fa40cd37d46ec0187cb462bb2ec.pdf
Mitoses,"Mitoses (1–10)",healthcare,"cancer prediction",https://pdfs.semanticscholar.org/08a6/c17e51ae3fa40cd37d46ec0187cb462bb2ec.pdf
age,"age of customer",healthcare,"patient forecast",https://pdfs.semanticscholar.org/7c5e/db59f788b58f3c5b449b6d11b9921a67ee11.pdf
first_present_transaction_time,"Time shows the time gap between the first transaction and the following one.",healthcare,"patient forecast",https://pdfs.semanticscholar.org/7c5e/db59f788b58f3c5b449b6d11b9921a67ee11.pdf
Platelets,"Platelets in blood",healthcare,"patient forecast",https://pdfs.semanticscholar.org/7c5e/db59f788b58f3c5b449b6d11b9921a67ee11.pdf
SC,"Level of creatinine in the blood",healthcare,"patient forecast",https://pdfs.semanticscholar.org/7c5e/db59f788b58f3c5b449b6d11b9921a67ee11.pdf
EF,"Percentage of leaving the heart at each concentration",healthcare,"patient forecast",https://pdfs.semanticscholar.org/7c5e/db59f788b58f3c5b449b6d11b9921a67ee11.pdf
CPK,"Level of CPK enzymes in the blood",healthcare,"patient forecast",https://pdfs.semanticscholar.org/7c5e/db59f788b58f3c5b449b6d11b9921a67ee11.pdf
marital_status," is the client married (Yes, No)",healthcare,"patient forecast",https://arxiv.org/pdf/2106.08488
gender,"Gender of the client",healthcare,"patient forecast",https://arxiv.org/pdf/2106.08488
location,"Customer location including city and region",healthcare,"patient forecast",https://arxiv.org/pdf/2106.08488
age,"age of customer",healthcare,"patient forecast",https://arxiv.org/pdf/2106.08488
income,"annual income of customer",healthcare,"patient forecast",https://arxiv.org/pdf/2106.08488
education,"Users' education level",healthcare,"patient forecast",https://arxiv.org/pdf/2106.08488
"Insurance information","Insurance provider, Mode of payment",healthcare,"patient forecast",https://arxiv.org/pdf/2106.08488
"General health information","Medical conditions, Allergies, Current medications, Completed outpatient appointment rate, Nursing home needed",healthcare,"patient forecast",https://arxiv.org/pdf/2106.08488
"Social history","Smoking, Alcohol, Living situation, Employment",healthcare,"patient forecast",https://arxiv.org/pdf/2106.08488
"Admission information","Admission date, First hospital visit, Elective, Number of admissions in a past time period, Cost-weight of previous admission, Diagnosis of last admission",healthcare,"patient forecast",https://arxiv.org/pdf/2106.08488
"Discharge information","Total charge, Discharge date, Transfer, Discharge disposition",healthcare,"patient forecast",https://arxiv.org/pdf/2106.08488
"Payment code information","ICD-10codes, ICD-9 codes, APR-DRG codes, DRG codes",healthcare,"patient forecast",https://arxiv.org/pdf/2106.08488
"In-hospital symptom","Vitals and lab values",healthcare,"patient forecast",https://arxiv.org/pdf/2106.08488
"Rhythmic features","Mean 10 most active hours, Total sleep time, Sedentary time",healthcare,"patient forecast",https://arxiv.org/pdf/2106.08488
"Medical images","Ultrasound exam",healthcare,"patient forecast",https://arxiv.org/pdf/2106.08488
"Hospital statistics","Total number of admissions, Number of patients, Percent readmission within a time period (30 days etc.)",healthcare,"patient forecast",https://arxiv.org/pdf/2106.08488
"Hospital characteristics","Ownership of hospital, Rural/Urban",healthcare,"patient forecast",https://arxiv.org/pdf/2106.08488
"LACE, HOSPITAL score, Charlson comorbidity score, Elixhauser Comorbidity Index, BaltimoreScore","LACE, HOSPITAL score, Charlson comorbidity score, Elixhauser Comorbidity Index, BaltimoreScore",healthcare,"patient forecast",https://arxiv.org/pdf/2106.08488
"Clinical nodes embedding features, Patient embedding features","Clinical nodes embedding features, Patient embedding features",healthcare,"patient forecast",https://arxiv.org/pdf/2106.08488
Ethnicity,Ethnicity,healthcare,"patient forecast",https://arxiv.org/pdf/2106.08488
household_size,"family size",healthcare,"patient forecast",https://arxiv.org/pdf/2106.08488
language,language,healthcare,"patient forecast",https://arxiv.org/pdf/2106.08488
age,"age of customer",healthcare,"patient churn",https://www.researchgate.net/profile/Ashok_Kumar_D/publication/277957391_Performance_and_Evaluation_of_Classification_Data_Mining_Techniques_in_Diabetes/links/5577b2ac08aeacff20004e8d/Performance-and-Evaluation-of-Classification-Data-Mining-Techniques-in-Diabetes.pdf
"Number of times pregnant","Number of times pregnant",healthcare,"patient churn",https://www.researchgate.net/profile/Ashok_Kumar_D/publication/277957391_Performance_and_Evaluation_of_Classification_Data_Mining_Techniques_in_Diabetes/links/5577b2ac08aeacff20004e8d/Performance-and-Evaluation-of-Classification-Data-Mining-Techniques-in-Diabetes.pdf
"Plasma glucose concentration a 2 hours in an oral glucose tolerance test","Plasma glucose concentration a 2 hours in an oral glucose tolerance test",healthcare,"patient churn",https://www.researchgate.net/profile/Ashok_Kumar_D/publication/277957391_Performance_and_Evaluation_of_Classification_Data_Mining_Techniques_in_Diabetes/links/5577b2ac08aeacff20004e8d/Performance-and-Evaluation-of-Classification-Data-Mining-Techniques-in-Diabetes.pdf
"Diastolic blood pressure","Diastolic blood pressure (mm Hg)",healthcare,"patient churn",https://www.researchgate.net/profile/Ashok_Kumar_D/publication/277957391_Performance_and_Evaluation_of_Classification_Data_Mining_Techniques_in_Diabetes/links/5577b2ac08aeacff20004e8d/Performance-and-Evaluation-of-Classification-Data-Mining-Techniques-in-Diabetes.pdf
"Triceps skin fold thickness (mm)","Triceps skin fold thickness (mm)",healthcare,"patient churn",https://www.researchgate.net/profile/Ashok_Kumar_D/publication/277957391_Performance_and_Evaluation_of_Classification_Data_Mining_Techniques_in_Diabetes/links/5577b2ac08aeacff20004e8d/Performance-and-Evaluation-of-Classification-Data-Mining-Techniques-in-Diabetes.pdf
"2-Hour serum insulin (mu U/ml)","2-Hour serum insulin (mu U/ml)",healthcare,"patient churn",https://www.researchgate.net/profile/Ashok_Kumar_D/publication/277957391_Performance_and_Evaluation_of_Classification_Data_Mining_Techniques_in_Diabetes/links/5577b2ac08aeacff20004e8d/Performance-and-Evaluation-of-Classification-Data-Mining-Techniques-in-Diabetes.pdf
BMI,"Body mass index (weight in Kg/Height in m2",healthcare,"patient churn",https://www.researchgate.net/profile/Ashok_Kumar_D/publication/277957391_Performance_and_Evaluation_of_Classification_Data_Mining_Techniques_in_Diabetes/links/5577b2ac08aeacff20004e8d/Performance-and-Evaluation-of-Classification-Data-Mining-Techniques-in-Diabetes.pdf
"Diabetes pedigree function","Diabetes pedigree function",healthcare,"patient churn",https://www.researchgate.net/profile/Ashok_Kumar_D/publication/277957391_Performance_and_Evaluation_of_Classification_Data_Mining_Techniques_in_Diabetes/links/5577b2ac08aeacff20004e8d/Performance-and-Evaluation-of-Classification-Data-Mining-Techniques-in-Diabetes.pdf
"Class variable (0=Tested Negative or 1=Tested Positive)","Class variable (0=Tested Negative or 1=Tested Positive)",healthcare,"patient churn",https://www.researchgate.net/profile/Ashok_Kumar_D/publication/277957391_Performance_and_Evaluation_of_Classification_Data_Mining_Techniques_in_Diabetes/links/5577b2ac08aeacff20004e8d/Performance-and-Evaluation-of-Classification-Data-Mining-Techniques-in-Diabetes.pdf
Total_Visits,"Total number of times a member made and attended a reservation",healthcare,"patient churn",http://www.ieomsociety.org/singapore2021/papers/720.pdf
No_Shows,"Total number of times a member made a reservation then did not show up",healthcare,"patient churn",http://www.ieomsociety.org/singapore2021/papers/720.pdf
Cancelled,"Total Number of times a member made and cancelled a reservation",healthcare,"patient churn",http://www.ieomsociety.org/singapore2021/papers/720.pdf
Member_Since,"Number of months since the member joined the gym",healthcare,"patient churn",http://www.ieomsociety.org/singapore2021/papers/720.pdf
Membership_Package,"The type of package a member chooses when signing, which are three types: Active, Active+, Athlete",healthcare,"patient churn",http://www.ieomsociety.org/singapore2021/papers/720.pdf
Membership_Period,"Sign up period which is either 3 or 6 months",healthcare,"patient churn",http://www.ieomsociety.org/singapore2021/papers/720.pdf
Status,"Either 1 for churn or 0 for non-churn",healthcare,"patient churn",http://www.ieomsociety.org/singapore2021/papers/720.pdf
marital_status," is the client married (Yes, No)",healthcare,"length of stay prediction",https://pdfs.semanticscholar.org/51aa/cfcf3f3c7680a65e9c7007f4bb97d090f0f7.pdf
gender,"Gender of the client",healthcare,"length of stay prediction",https://pdfs.semanticscholar.org/51aa/cfcf3f3c7680a65e9c7007f4bb97d090f0f7.pdf
age,"age of customer",healthcare,"length of stay prediction",https://pdfs.semanticscholar.org/51aa/cfcf3f3c7680a65e9c7007f4bb97d090f0f7.pdf
"Social history","Smoking, Alcohol, Living situation, Employment",healthcare,"length of stay prediction",https://pdfs.semanticscholar.org/51aa/cfcf3f3c7680a65e9c7007f4bb97d090f0f7.pdf
"Diastolic blood pressure","Diastolic blood pressure (mm Hg)",healthcare,"length of stay prediction",https://pdfs.semanticscholar.org/51aa/cfcf3f3c7680a65e9c7007f4bb97d090f0f7.pdf
"Surgery type","Surgery type",healthcare,"length of stay prediction",https://pdfs.semanticscholar.org/51aa/cfcf3f3c7680a65e9c7007f4bb97d090f0f7.pdf
"Average number of visits per day","Average number of visits per day",healthcare,"length of stay prediction",https://pdfs.semanticscholar.org/51aa/cfcf3f3c7680a65e9c7007f4bb97d090f0f7.pdf
"Number of consultations","Number of medical consultations",healthcare,"length of stay prediction",https://pdfs.semanticscholar.org/51aa/cfcf3f3c7680a65e9c7007f4bb97d090f0f7.pdf
"Number of surgeries","Number of surgeries",healthcare,"length of stay prediction",https://pdfs.semanticscholar.org/51aa/cfcf3f3c7680a65e9c7007f4bb97d090f0f7.pdf
"Interval between discharge order and discharge","Interval between discharge order and discharge",healthcare,"length of stay prediction",https://pdfs.semanticscholar.org/51aa/cfcf3f3c7680a65e9c7007f4bb97d090f0f7.pdf
"Transmission between parts","Transmission between parts",healthcare,"length of stay prediction",https://pdfs.semanticscholar.org/51aa/cfcf3f3c7680a65e9c7007f4bb97d090f0f7.pdf
"Preoperative hospitalization","Preoperative hospitalization",healthcare,"length of stay prediction",https://pdfs.semanticscholar.org/51aa/cfcf3f3c7680a65e9c7007f4bb97d090f0f7.pdf
"Number of tests","Number of tests",healthcare,"length of stay prediction",https://pdfs.semanticscholar.org/51aa/cfcf3f3c7680a65e9c7007f4bb97d090f0f7.pdf
Lodging,Lodging,healthcare,"length of stay prediction",https://pdfs.semanticscholar.org/51aa/cfcf3f3c7680a65e9c7007f4bb97d090f0f7.pdf
"Insurance type","Insurance type",healthcare,"length of stay prediction",https://pdfs.semanticscholar.org/51aa/cfcf3f3c7680a65e9c7007f4bb97d090f0f7.pdf
"Pulse rate","Pulse rate",healthcare,"length of stay prediction",https://pdfs.semanticscholar.org/51aa/cfcf3f3c7680a65e9c7007f4bb97d090f0f7.pdf
"Systolic blood pressure","Systolic blood pressure",healthcare,"length of stay prediction",https://pdfs.semanticscholar.org/51aa/cfcf3f3c7680a65e9c7007f4bb97d090f0f7.pdf
"Co-morbidities (hypertension, diabetes)","Co-morbidities (hypertension, diabetes)",healthcare,"length of stay prediction",https://pdfs.semanticscholar.org/51aa/cfcf3f3c7680a65e9c7007f4bb97d090f0f7.pdf
"Hospitalization / surgical history","Hospitalization / surgical history",healthcare,"length of stay prediction",https://pdfs.semanticscholar.org/51aa/cfcf3f3c7680a65e9c7007f4bb97d090f0f7.pdf
Hemoglobin,Hemoglobin,healthcare,"length of stay prediction",https://pdfs.semanticscholar.org/51aa/cfcf3f3c7680a65e9c7007f4bb97d090f0f7.pdf
"Fever before surgery","Fever before surgery",healthcare,"length of stay prediction",https://pdfs.semanticscholar.org/51aa/cfcf3f3c7680a65e9c7007f4bb97d090f0f7.pdf
"Fever after surgery","Fever after surgery",healthcare,"length of stay prediction",https://pdfs.semanticscholar.org/51aa/cfcf3f3c7680a65e9c7007f4bb97d090f0f7.pdf
"Respiratory rate before surgery","Respiratory rate before surgery",healthcare,"length of stay prediction",https://pdfs.semanticscholar.org/51aa/cfcf3f3c7680a65e9c7007f4bb97d090f0f7.pdf
"Respiratory rate after surgery","Respiratory rate after surgery",healthcare,"length of stay prediction",https://pdfs.semanticscholar.org/51aa/cfcf3f3c7680a65e9c7007f4bb97d090f0f7.pdf
"Patient's condition at time of admission","Patient's condition at time of admission",healthcare,"length of stay prediction",https://pdfs.semanticscholar.org/51aa/cfcf3f3c7680a65e9c7007f4bb97d090f0f7.pdf
"Patient's condition at time of discharge","Patient's condition at time of discharge",healthcare,"length of stay prediction",https://pdfs.semanticscholar.org/51aa/cfcf3f3c7680a65e9c7007f4bb97d090f0f7.pdf
"Length of surgery","Length of surgery",healthcare,"length of stay prediction",https://pdfs.semanticscholar.org/51aa/cfcf3f3c7680a65e9c7007f4bb97d090f0f7.pdf
"Using ICU","Using ICU",healthcare,"length of stay prediction",https://pdfs.semanticscholar.org/51aa/cfcf3f3c7680a65e9c7007f4bb97d090f0f7.pdf
"Interval between first and last medical consultation","Interval between first and last medical consultation",healthcare,"length of stay prediction",https://pdfs.semanticscholar.org/51aa/cfcf3f3c7680a65e9c7007f4bb97d090f0f7.pdf
"Admission type","Admission type",healthcare,"length of stay prediction",https://pdfs.semanticscholar.org/51aa/cfcf3f3c7680a65e9c7007f4bb97d090f0f7.pdf
gender,"Gender of the client",healthcare,"length of stay prediction",https://arxiv.org/pdf/2006.16109
age,"age of customer",healthcare,"length of stay prediction",https://arxiv.org/pdf/2006.16109
"Hour of Admission","Hour of Admission",healthcare,"length of stay prediction",https://arxiv.org/pdf/2006.16109
Height,Height,healthcare,"length of stay prediction",https://arxiv.org/pdf/2006.16109
Weight,Weight,healthcare,"length of stay prediction",https://arxiv.org/pdf/2006.16109
Ethnicity,Ethnicity,healthcare,"length of stay prediction",https://arxiv.org/pdf/2006.16109
"Unit Type","Unit Type",healthcare,"length of stay prediction",https://arxiv.org/pdf/2006.16109
"Unit Admit Source","Unit Admit Source",healthcare,"length of stay prediction",https://arxiv.org/pdf/2006.16109
"Unit Visit Number","Unit Visit Number",healthcare,"length of stay prediction",https://arxiv.org/pdf/2006.16109
"Unit Stay Type","Unit Stay Type",healthcare,"length of stay prediction",https://arxiv.org/pdf/2006.16109
"Num Beds Category","Num Beds Category",healthcare,"length of stay prediction",https://arxiv.org/pdf/2006.16109
Region,Region,healthcare,"length of stay prediction",https://arxiv.org/pdf/2006.16109
"Teaching Status","Teaching Status",healthcare,"length of stay prediction",https://arxiv.org/pdf/2006.16109
"Physician Speciality","Physician Speciality",healthcare,"length of stay prediction",https://arxiv.org/pdf/2006.16109
"Diastolic blood pressure","Diastolic blood pressure (mm Hg)",healthcare,"stroke prediction",https://arxiv.org/pdf/2003.08239
"Systolic blood pressure","Systolic blood pressure",healthcare,"stroke prediction",https://arxiv.org/pdf/2003.08239
"Total cholesterol Level (mg/dl)","Total cholesterol Level (mg/dl)",healthcare,"stroke prediction",https://arxiv.org/pdf/2003.08239
"Smoking rate (Cig/Day)","Smoking rate (Cig/Day)",healthcare,"stroke prediction",https://arxiv.org/pdf/2003.08239
retired_flag," is the client retired (1, 0)",healthcare,"stroke prediction",https://arxiv.org/pdf/2107.14060
age,"age of customer",healthcare,"stroke prediction",https://arxiv.org/pdf/2107.14060
education,"Users' education level",healthcare,"stroke prediction",https://arxiv.org/pdf/2107.14060
BMI,"Body mass index (weight in Kg/Height in m2",healthcare,"stroke prediction",https://arxiv.org/pdf/2107.14060
Height,Height,healthcare,"stroke prediction",https://arxiv.org/pdf/2107.14060
Weight,Weight,healthcare,"stroke prediction",https://arxiv.org/pdf/2107.14060
"Total cholesterol Level (mg/dl)","Total cholesterol Level (mg/dl)",healthcare,"stroke prediction",https://arxiv.org/pdf/2107.14060
arrhythmia,"1: YES. 0: NO",healthcare,"stroke prediction",https://arxiv.org/pdf/2107.14060
"lack of exercise","1: YES. 0: NO",healthcare,"stroke prediction",https://arxiv.org/pdf/2107.14060
"Fasting Blood Glucose","normal range: 3.9-6.1mmol/L",healthcare,"stroke prediction",https://arxiv.org/pdf/2107.14060
"glycosylated hemoglobin","normal range: 4%-6%",healthcare,"stroke prediction",https://arxiv.org/pdf/2107.14060
Homocysteine,"normal range: 5-15µmol{L",healthcare,"stroke prediction",https://arxiv.org/pdf/2107.14060
"High Density LipoproteinCholesterol","normal range for female:1.29-1.55 mmol/L;normal range for male:1.16-1.42 mmol/L",healthcare,"stroke prediction",https://arxiv.org/pdf/2107.14060
"History of Hypertension","1: YES. 0: NO",healthcare,"stroke prediction",https://arxiv.org/pdf/2107.14060
"History of Stroke","1: YES. 0: NO",healthcare,"stroke prediction",https://arxiv.org/pdf/2107.14060
"Left Diastolic Blood Pressure","normal range: 60-89mmHg",healthcare,"stroke prediction",https://arxiv.org/pdf/2107.14060
"Low Density LipoproteinCholesterol","normal range: ă 3.37mmol",healthcare,"stroke prediction",https://arxiv.org/pdf/2107.14060
"Left Systolic Blood Pressure","normal range: 80-140mmHg1",healthcare,"stroke prediction",https://arxiv.org/pdf/2107.14060
"Meat and Vegetable","1: equilibrium.2: partial vegetable.3 partial meat.",healthcare,"stroke prediction",https://arxiv.org/pdf/2107.14060
Smoking,"2: YES. 1: Quitting. 0: NO",healthcare,"stroke prediction",https://arxiv.org/pdf/2107.14060
