"Feature Name","Feature Description",Industry,Usecase,Source
"credit score","A value between 0 and 800 indicating the riskiness of the borrower’s credit history.","banking financial service and insurance","customer segmentation",https://www.researchgate.net/publication/327207014_CUSTOMER_PROFILING_AND_SEGMENTATION_IN_RETAIL_BANKS_USING_DATA_MINING_TECHNIQUES
"relationship time with bank","Financial Variables","banking financial service and insurance","customer segmentation",https://www.researchgate.net/publication/327207014_CUSTOMER_PROFILING_AND_SEGMENTATION_IN_RETAIL_BANKS_USING_DATA_MINING_TECHNIQUES
liabilities,"Financial Variables","banking financial service and insurance","customer segmentation",https://www.researchgate.net/publication/327207014_CUSTOMER_PROFILING_AND_SEGMENTATION_IN_RETAIL_BANKS_USING_DATA_MINING_TECHNIQUES
"contingent liabilities","Financial Variables","banking financial service and insurance","customer segmentation",https://www.researchgate.net/publication/327207014_CUSTOMER_PROFILING_AND_SEGMENTATION_IN_RETAIL_BANKS_USING_DATA_MINING_TECHNIQUES
"deposits with bank","Money placed into the bank","banking financial service and insurance","customer segmentation",https://www.researchgate.net/publication/327207014_CUSTOMER_PROFILING_AND_SEGMENTATION_IN_RETAIL_BANKS_USING_DATA_MINING_TECHNIQUES
"risk level","Financial Variables","banking financial service and insurance","customer segmentation",https://www.researchgate.net/publication/327207014_CUSTOMER_PROFILING_AND_SEGMENTATION_IN_RETAIL_BANKS_USING_DATA_MINING_TECHNIQUES
"threshold level","Financial Variables","banking financial service and insurance","customer segmentation",https://www.researchgate.net/publication/327207014_CUSTOMER_PROFILING_AND_SEGMENTATION_IN_RETAIL_BANKS_USING_DATA_MINING_TECHNIQUES
"relationship with bank","Behavior Data","banking financial service and insurance","customer segmentation",https://www.researchgate.net/publication/327207014_CUSTOMER_PROFILING_AND_SEGMENTATION_IN_RETAIL_BANKS_USING_DATA_MINING_TECHNIQUES
"customer behavior","Behavior Data","banking financial service and insurance","customer segmentation",https://www.researchgate.net/publication/327207014_CUSTOMER_PROFILING_AND_SEGMENTATION_IN_RETAIL_BANKS_USING_DATA_MINING_TECHNIQUES
"buying preferences","Behavior Data","banking financial service and insurance","customer segmentation",https://www.researchgate.net/publication/327207014_CUSTOMER_PROFILING_AND_SEGMENTATION_IN_RETAIL_BANKS_USING_DATA_MINING_TECHNIQUES
"repayment pattern","Behavior Data","banking financial service and insurance","customer segmentation",https://www.researchgate.net/publication/327207014_CUSTOMER_PROFILING_AND_SEGMENTATION_IN_RETAIL_BANKS_USING_DATA_MINING_TECHNIQUES
"transaction history","Behavior Data","banking financial service and insurance","customer segmentation",https://www.researchgate.net/publication/327207014_CUSTOMER_PROFILING_AND_SEGMENTATION_IN_RETAIL_BANKS_USING_DATA_MINING_TECHNIQUES
paymentmethod,"payment method (Electronic check, Mailed check, Bank transfer (automatic), Credit card (automatic))","banking financial service and insurance","customer segmentation",https://www.researchgate.net/publication/276089828_Business_Client_Segmentation_in_Banking_Using_Self-Organizing_Maps
"the importance of selecting a bank providing services for clients (likert 1-5)","Decision maker preferences","banking financial service and insurance","customer segmentation",https://www.researchgate.net/publication/276089828_Business_Client_Segmentation_in_Banking_Using_Self-Organizing_Maps
"client rating of the best bank in croatia (likert 1-5)","Business client characteristics","banking financial service and insurance","customer segmentation",https://www.researchgate.net/publication/276089828_Business_Client_Segmentation_in_Banking_Using_Self-Organizing_Maps
"total number of employees","the number of employees engaged at the place of business each regular working day during the preceding calendar year","banking financial service and insurance","customer segmentation",https://www.researchgate.net/publication/276089828_Business_Client_Segmentation_in_Banking_Using_Self-Organizing_Maps
"increase / decrease in revenues compared to the previous year (numeric)","Business client characteristics","banking financial service and insurance","customer segmentation",https://www.researchgate.net/publication/276089828_Business_Client_Segmentation_in_Banking_Using_Self-Organizing_Maps
"total income in the previous year (numeric)","Business client characteristics","banking financial service and insurance","customer segmentation",https://www.researchgate.net/publication/276089828_Business_Client_Segmentation_in_Banking_Using_Self-Organizing_Maps
"plans related to the number of employees (nominal)","Business client characteristics","banking financial service and insurance","customer segmentation",https://www.researchgate.net/publication/276089828_Business_Client_Segmentation_in_Banking_Using_Self-Organizing_Maps
"main business activity (nominal)","Business client characteristics","banking financial service and insurance","customer segmentation",https://www.researchgate.net/publication/276089828_Business_Client_Segmentation_in_Banking_Using_Self-Organizing_Maps
"legal form of the company (nominal)","Business client characteristics","banking financial service and insurance","customer segmentation",https://www.researchgate.net/publication/276089828_Business_Client_Segmentation_in_Banking_Using_Self-Organizing_Maps
"percentage of import and export in annual sales (numeric)","Business client characteristics","banking financial service and insurance","customer segmentation",https://www.researchgate.net/publication/276089828_Business_Client_Segmentation_in_Banking_Using_Self-Organizing_Maps
"ownership form of the company and the capital origin (nominal)","Business client characteristics","banking financial service and insurance","customer segmentation",https://www.researchgate.net/publication/276089828_Business_Client_Segmentation_in_Banking_Using_Self-Organizing_Maps
"the financial position of the company (nominal)","Business client characteristics","banking financial service and insurance","customer segmentation",https://www.researchgate.net/publication/276089828_Business_Client_Segmentation_in_Banking_Using_Self-Organizing_Maps
"headquarters of the company and the year of establishment (nominal)","Business client characteristics","banking financial service and insurance","customer segmentation",https://www.researchgate.net/publication/276089828_Business_Client_Segmentation_in_Banking_Using_Self-Organizing_Maps
"the most important reasons which affect the selection of a bank for a loan request (likert 1-5)","Operating criterion","banking financial service and insurance","customer segmentation",https://www.researchgate.net/publication/276089828_Business_Client_Segmentation_in_Banking_Using_Self-Organizing_Maps
"credit cards used by a client (binomial 0-1)","Operating criterion","banking financial service and insurance","customer segmentation",https://www.researchgate.net/publication/276089828_Business_Client_Segmentation_in_Banking_Using_Self-Organizing_Maps
"credit cards which a company is planning to use (binomial 0-1)","Operating criterion","banking financial service and insurance","customer segmentation",https://www.researchgate.net/publication/276089828_Business_Client_Segmentation_in_Banking_Using_Self-Organizing_Maps
"the three most important characteristics of a bank (e.g. security and stability, commissions and fees, keeping up with promises) (likert 1-5)","Supply management approach criterion","banking financial service and insurance","customer segmentation",https://www.researchgate.net/publication/276089828_Business_Client_Segmentation_in_Banking_Using_Self-Organizing_Maps
"the three most important characteristics of bank services (e.g. a wide spectrum of services, quality and price ratio and promptness in solving requests) (likert 1-5)","Supply management approach criterion","banking financial service and insurance","customer segmentation",https://www.researchgate.net/publication/276089828_Business_Client_Segmentation_in_Banking_Using_Self-Organizing_Maps
"the major bank where most of the services are used (binomial 0-1)","Situational criterion","banking financial service and insurance","customer segmentation",https://www.researchgate.net/publication/276089828_Business_Client_Segmentation_in_Banking_Using_Self-Organizing_Maps
"level of satisfaction with the current major bank (likert 1-5)","Situational criterion","banking financial service and insurance","customer segmentation",https://www.researchgate.net/publication/276089828_Business_Client_Segmentation_in_Banking_Using_Self-Organizing_Maps
marital_status," is the client married (Yes, No)","banking financial service and insurance","customer segmentation",https://www.csp.com/customer-segmentation-value/#.YQCFPFMzaqA
gender,"Gender of the client","banking financial service and insurance","customer segmentation",https://www.csp.com/customer-segmentation-value/#.YQCFPFMzaqA
location,"Customer location including city and region","banking financial service and insurance","customer segmentation",https://www.csp.com/customer-segmentation-value/#.YQCFPFMzaqA
age,"age of customer","banking financial service and insurance","customer segmentation",https://www.csp.com/customer-segmentation-value/#.YQCFPFMzaqA
income,"annual income of customer","banking financial service and insurance","customer segmentation",https://www.csp.com/customer-segmentation-value/#.YQCFPFMzaqA
"customer value","How many products & services customers purchase and what kind of revenue that generates for the bank - past, current, and predicted for the future","banking financial service and insurance","customer segmentation",https://www.csp.com/customer-segmentation-value/#.YQCFPFMzaqA
"life stage","Slightly different from age, focused instead on customers' journeys through various milestones and markers; for example, graduating college or starting a family","banking financial service and insurance","customer segmentation",https://www.csp.com/customer-segmentation-value/#.YQCFPFMzaqA
attitude,"Customers' subjective stances on things like the financial industry as a whole, online and mobile banking, the economy, and their satisfaction with their bank","banking financial service and insurance","customer segmentation",https://www.csp.com/customer-segmentation-value/#.YQCFPFMzaqA
behavior,"Interactions and transactions between customers and their bank, which channels they use and how often, and which products they adopt","banking financial service and insurance","customer segmentation",https://www.csp.com/customer-segmentation-value/#.YQCFPFMzaqA
generation,"generation eg baby boomers","banking financial service and insurance","customer segmentation",https://www.csp.com/customer-segmentation-value/#.YQCFPFMzaqA
contract," type of customer contract (Month to month, one year, two year",telecommunication,"customer segmentation",https://www.researchgate.net/profile/Ahsan-Rehman/publication/304822719_Customer_Churn_Prediction_Segmentation_and_Fraud_Detection_in_Telecommunication_Industry/links/577bcfd708ae213761cab2e0/Customer-Churn-Prediction-Segmentation-and-Fraud-Detection-in-Telecommunication-Industry.pdf
gender,"Gender of the client",telecommunication,"customer segmentation",https://www.researchgate.net/profile/Ahsan-Rehman/publication/304822719_Customer_Churn_Prediction_Segmentation_and_Fraud_Detection_in_Telecommunication_Industry/links/577bcfd708ae213761cab2e0/Customer-Churn-Prediction-Segmentation-and-Fraud-Detection-in-Telecommunication-Industry.pdf
aon,"age on cellular network in days",telecommunication,"customer segmentation",https://www.researchgate.net/profile/Ahsan-Rehman/publication/304822719_Customer_Churn_Prediction_Segmentation_and_Fraud_Detection_in_Telecommunication_Industry/links/577bcfd708ae213761cab2e0/Customer-Churn-Prediction-Segmentation-and-Fraud-Detection-in-Telecommunication-Industry.pdf
"total outgoing minutes","Total minutes of outgoing call",telecommunication,"customer segmentation",https://www.researchgate.net/profile/Ahsan-Rehman/publication/304822719_Customer_Churn_Prediction_Segmentation_and_Fraud_Detection_in_Telecommunication_Industry/links/577bcfd708ae213761cab2e0/Customer-Churn-Prediction-Segmentation-and-Fraud-Detection-in-Telecommunication-Industry.pdf
"total outgoing revenue","Total revenue generating by outgoing calls",telecommunication,"customer segmentation",https://www.researchgate.net/profile/Ahsan-Rehman/publication/304822719_Customer_Churn_Prediction_Segmentation_and_Fraud_Detection_in_Telecommunication_Industry/links/577bcfd708ae213761cab2e0/Customer-Churn-Prediction-Segmentation-and-Fraud-Detection-in-Telecommunication-Industry.pdf
"total vas revenue","Internet (GPRS), interactive voice response (IVR), ringback tones, Multimedia Message Service (MMS) etc. related usage",telecommunication,"customer segmentation",https://www.researchgate.net/profile/Ahsan-Rehman/publication/304822719_Customer_Churn_Prediction_Segmentation_and_Fraud_Detection_in_Telecommunication_Industry/links/577bcfd708ae213761cab2e0/Customer-Churn-Prediction-Segmentation-and-Fraud-Detection-in-Telecommunication-Industry.pdf
"total incoming minutes","Total minutes of incoming call",telecommunication,"customer segmentation",https://www.researchgate.net/profile/Ahsan-Rehman/publication/304822719_Customer_Churn_Prediction_Segmentation_and_Fraud_Detection_in_Telecommunication_Industry/links/577bcfd708ae213761cab2e0/Customer-Churn-Prediction-Segmentation-and-Fraud-Detection-in-Telecommunication-Industry.pdf
"total incoming revenue","Total revenue generating by incoming calls",telecommunication,"customer segmentation",https://www.researchgate.net/profile/Ahsan-Rehman/publication/304822719_Customer_Churn_Prediction_Segmentation_and_Fraud_Detection_in_Telecommunication_Industry/links/577bcfd708ae213761cab2e0/Customer-Churn-Prediction-Segmentation-and-Fraud-Detection-in-Telecommunication-Industry.pdf
"active days","Total revenue generating days",telecommunication,"customer segmentation",https://www.researchgate.net/profile/Ahsan-Rehman/publication/304822719_Customer_Churn_Prediction_Segmentation_and_Fraud_Detection_in_Telecommunication_Industry/links/577bcfd708ae213761cab2e0/Customer-Churn-Prediction-Segmentation-and-Fraud-Detection-in-Telecommunication-Industry.pdf
"average call distance","Time between two consecutive call",telecommunication,"customer segmentation",https://www.researchgate.net/profile/Ahsan-Rehman/publication/304822719_Customer_Churn_Prediction_Segmentation_and_Fraud_Detection_in_Telecommunication_Industry/links/577bcfd708ae213761cab2e0/Customer-Churn-Prediction-Segmentation-and-Fraud-Detection-in-Telecommunication-Industry.pdf
"total inactive days","Total number of inactive days",telecommunication,"customer segmentation",https://www.researchgate.net/profile/Ahsan-Rehman/publication/304822719_Customer_Churn_Prediction_Segmentation_and_Fraud_Detection_in_Telecommunication_Industry/links/577bcfd708ae213761cab2e0/Customer-Churn-Prediction-Segmentation-and-Fraud-Detection-in-Telecommunication-Industry.pdf
"maximum inactive days","Consecutive number of inactivity days",telecommunication,"customer segmentation",https://www.researchgate.net/profile/Ahsan-Rehman/publication/304822719_Customer_Churn_Prediction_Segmentation_and_Fraud_Detection_in_Telecommunication_Industry/links/577bcfd708ae213761cab2e0/Customer-Churn-Prediction-Segmentation-and-Fraud-Detection-in-Telecommunication-Industry.pdf
"network age days","Scoring date - activation date",telecommunication,"customer segmentation",https://www.researchgate.net/profile/Ahsan-Rehman/publication/304822719_Customer_Churn_Prediction_Segmentation_and_Fraud_Detection_in_Telecommunication_Industry/links/577bcfd708ae213761cab2e0/Customer-Churn-Prediction-Segmentation-and-Fraud-Detection-in-Telecommunication-Industry.pdf
"revenue line-rent average","Average Revenue generating through rent amounts for the entire lease term, and then divides the sum by the number of months in the lease term",telecommunication,"customer segmentation",https://www.researchgate.net/profile/Ahsan-Rehman/publication/304822719_Customer_Churn_Prediction_Segmentation_and_Fraud_Detection_in_Telecommunication_Industry/links/577bcfd708ae213761cab2e0/Customer-Churn-Prediction-Segmentation-and-Fraud-Detection-in-Telecommunication-Industry.pdf
"payment amount average","Average payment amount",telecommunication,"customer segmentation",https://www.researchgate.net/profile/Ahsan-Rehman/publication/304822719_Customer_Churn_Prediction_Segmentation_and_Fraud_Detection_in_Telecommunication_Industry/links/577bcfd708ae213761cab2e0/Customer-Churn-Prediction-Segmentation-and-Fraud-Detection-in-Telecommunication-Industry.pdf
arpu,"Average revenue per user",telecommunication,"customer segmentation",https://www.researchgate.net/profile/Ahsan-Rehman/publication/304822719_Customer_Churn_Prediction_Segmentation_and_Fraud_Detection_in_Telecommunication_Industry/links/577bcfd708ae213761cab2e0/Customer-Churn-Prediction-Segmentation-and-Fraud-Detection-in-Telecommunication-Industry.pdf
location,"Customer location including city and region",telecommunication,"customer segmentation",https://www.researchgate.net/profile/Ahsan-Rehman/publication/304822719_Customer_Churn_Prediction_Segmentation_and_Fraud_Detection_in_Telecommunication_Industry/links/577bcfd708ae213761cab2e0/Customer-Churn-Prediction-Segmentation-and-Fraud-Detection-in-Telecommunication-Industry.pdf
"customer data","Contains all data related to customer's services and contract information",telecommunication,"customer segmentation",https://www.researchgate.net/profile/Ahsan-Rehman/publication/304822719_Customer_Churn_Prediction_Segmentation_and_Fraud_Detection_in_Telecommunication_Industry/links/577bcfd708ae213761cab2e0/Customer-Churn-Prediction-Segmentation-and-Fraud-Detection-in-Telecommunication-Industry.pdf
contract," type of customer contract (Month to month, one year, two year",telecommunication,"customer segmentation",https://link.springer.com/article/10.1057/dbm.2010.21
gender,"Gender of the client",telecommunication,"customer segmentation",https://link.springer.com/article/10.1057/dbm.2010.21
aon,"age on cellular network in days",telecommunication,"customer segmentation",https://link.springer.com/article/10.1057/dbm.2010.21
"total outgoing minutes","Total minutes of outgoing call",telecommunication,"customer segmentation",https://link.springer.com/article/10.1057/dbm.2010.21
"total outgoing revenue","Total revenue generating by outgoing calls",telecommunication,"customer segmentation",https://link.springer.com/article/10.1057/dbm.2010.21
"total vas revenue","Internet (GPRS), interactive voice response (IVR), ringback tones, Multimedia Message Service (MMS) etc. related usage",telecommunication,"customer segmentation",https://link.springer.com/article/10.1057/dbm.2010.21
"total incoming minutes","Total minutes of incoming call",telecommunication,"customer segmentation",https://link.springer.com/article/10.1057/dbm.2010.21
"total incoming revenue","Total revenue generating by incoming calls",telecommunication,"customer segmentation",https://link.springer.com/article/10.1057/dbm.2010.21
"active days","Total revenue generating days",telecommunication,"customer segmentation",https://link.springer.com/article/10.1057/dbm.2010.21
"average call distance","Time between two consecutive call",telecommunication,"customer segmentation",https://link.springer.com/article/10.1057/dbm.2010.21
"total inactive days","Total number of inactive days",telecommunication,"customer segmentation",https://link.springer.com/article/10.1057/dbm.2010.21
"maximum inactive days","Consecutive number of inactivity days",telecommunication,"customer segmentation",https://link.springer.com/article/10.1057/dbm.2010.21
"network age days","Scoring date - activation date",telecommunication,"customer segmentation",https://link.springer.com/article/10.1057/dbm.2010.21
"revenue line-rent average","Average Revenue generating through rent amounts for the entire lease term, and then divides the sum by the number of months in the lease term",telecommunication,"customer segmentation",https://link.springer.com/article/10.1057/dbm.2010.21
"payment amount average","Average payment amount",telecommunication,"customer segmentation",https://link.springer.com/article/10.1057/dbm.2010.21
arpu,"Average revenue per user",telecommunication,"customer segmentation",https://link.springer.com/article/10.1057/dbm.2010.21
location,"Customer location including city and region",telecommunication,"customer segmentation",https://link.springer.com/article/10.1057/dbm.2010.21
"customer data","Contains all data related to customer's services and contract information",telecommunication,"customer segmentation",https://link.springer.com/article/10.1057/dbm.2010.21
"Policy Number","Unique policy identification number",healthcare,"fraud detection",https://arxiv.org/pdf/2102.10978
"Insured Id","Unique ID given to insured",healthcare,"fraud detection",https://arxiv.org/pdf/2102.10978
"Claim Identification Number","Unique claim identification number",healthcare,"fraud detection",https://arxiv.org/pdf/2102.10978
"Benefit Type","Type of benefit (medical / surgical)",healthcare,"fraud detection",https://arxiv.org/pdf/2102.10978
"Claim Status","Current status of the claim",healthcare,"fraud detection",https://arxiv.org/pdf/2102.10978
"Treatment Start Date","Treatment Start Date",healthcare,"fraud detection",https://arxiv.org/pdf/2102.10978
"Treatment End Date","Treatment End Date",healthcare,"fraud detection",https://arxiv.org/pdf/2102.10978
"Claim Settlement Date","Date at which the claims were settled",healthcare,"fraud detection",https://arxiv.org/pdf/2102.10978
"Claim Reported Date","Date at which the claims were reported",healthcare,"fraud detection",https://arxiv.org/pdf/2102.10978
"Claim Billed Amount","Claims amount billed",healthcare,"fraud detection",https://arxiv.org/pdf/2102.10978
"Approved / Allowed Amount","Approved / Allowed Amount",healthcare,"fraud detection",https://arxiv.org/pdf/2102.10978
"Claim Paid Amount","Claims amount paid",healthcare,"fraud detection",https://arxiv.org/pdf/2102.10978
"Medical Service Provider ID","Unique ID given to hospitals",healthcare,"fraud detection",https://arxiv.org/pdf/2102.10978
payment_type,"CASH-IN, CASH-OUT, DEBIT, PAYMENT and TRANSFER","banking financial service and insurance","fraud detection",https://www.kaggle.com/arjunjoshua/predicting-fraud-in-financial-payment-services/data
transaction_amount,"amount of the transaction in local currency","banking financial service and insurance","fraud detection",https://www.kaggle.com/arjunjoshua/predicting-fraud-in-financial-payment-services/data
nameorig,"customer who started the transaction","banking financial service and insurance","fraud detection",https://www.kaggle.com/arjunjoshua/predicting-fraud-in-financial-payment-services/data
oldbalanceorig,"initial balance before the transaction","banking financial service and insurance","fraud detection",https://www.kaggle.com/arjunjoshua/predicting-fraud-in-financial-payment-services/data
newbalanceorig,"customer's balance after the transaction","banking financial service and insurance","fraud detection",https://www.kaggle.com/arjunjoshua/predicting-fraud-in-financial-payment-services/data
namedest,"recipient ID of the transaction","banking financial service and insurance","fraud detection",https://www.kaggle.com/arjunjoshua/predicting-fraud-in-financial-payment-services/data
oldbalancedest,"initial recipient balance before the transaction","banking financial service and insurance","fraud detection",https://www.kaggle.com/arjunjoshua/predicting-fraud-in-financial-payment-services/data
newbalancedest,"recipient's balance after the transaction","banking financial service and insurance","fraud detection",https://www.kaggle.com/arjunjoshua/predicting-fraud-in-financial-payment-services/data
isfraud,"identifies a fraudulent transaction (1) and non fraudulent (0)","banking financial service and insurance","fraud detection",https://www.kaggle.com/arjunjoshua/predicting-fraud-in-financial-payment-services/data
gender,"Gender of the client","banking financial service and insurance","fraud detection",https://thesai.org/Downloads/Volume9No1/Paper_3-Credit_Card_Fraud_Detection_Using_Deep_Learning.pdf
income,"annual income of customer","banking financial service and insurance","fraud detection",https://thesai.org/Downloads/Volume9No1/Paper_3-Credit_Card_Fraud_Detection_Using_Deep_Learning.pdf
"credit history","no credits taken/all credits paid back duly/existing credits paid back duly till now/delay in paying off in the past/critical account/ other credits existing (not at this bank)","banking financial service and insurance","fraud detection",https://thesai.org/Downloads/Volume9No1/Paper_3-Credit_Card_Fraud_Detection_Using_Deep_Learning.pdf
credit_card_purpose,"purpose to use credit card","banking financial service and insurance","fraud detection",https://thesai.org/Downloads/Volume9No1/Paper_3-Credit_Card_Fraud_Detection_Using_Deep_Learning.pdf
"credit amount","amount of money credited","banking financial service and insurance","fraud detection",https://thesai.org/Downloads/Volume9No1/Paper_3-Credit_Card_Fraud_Detection_Using_Deep_Learning.pdf
employment_status,"present employment status of customer","banking financial service and insurance","fraud detection",https://thesai.org/Downloads/Volume9No1/Paper_3-Credit_Card_Fraud_Detection_Using_Deep_Learning.pdf
"installment rate","Installment rate","banking financial service and insurance","fraud detection",https://thesai.org/Downloads/Volume9No1/Paper_3-Credit_Card_Fraud_Detection_Using_Deep_Learning.pdf
