"Feature Name","Feature Description",Industry,Usecase,Source
"Carrier On-timePickup","Indicator of ontime Pickup (1 indicates True; 0 indicates False)",gaming,"customer churn prediction",https://dspace.mit.edu/bitstream/handle/1721.1/130953/Rehan_Jungsakulrujirek_Defining%20and%20Detecting%20Churn%20in%20Truckload%20Transportation.pdf?sequence=1&isAllowed=y
"Carrier On-timeDelivery","Indicator of On-time Delivery (1 indicates True; 0 indicates False)",gaming,"customer churn prediction",https://dspace.mit.edu/bitstream/handle/1721.1/130953/Rehan_Jungsakulrujirek_Defining%20and%20Detecting%20Churn%20in%20Truckload%20Transportation.pdf?sequence=1&isAllowed=y
"Pickup LoadAction","Loading type at origin ('Drop &Hook’  or 'Live Load')",gaming,"customer churn prediction",https://dspace.mit.edu/bitstream/handle/1721.1/130953/Rehan_Jungsakulrujirek_Defining%20and%20Detecting%20Churn%20in%20Truckload%20Transportation.pdf?sequence=1&isAllowed=y
"Delivery LoadAction","Unloading at destination location ('Drop & Hook' or 'Live Unload')",gaming,"customer churn prediction",https://dspace.mit.edu/bitstream/handle/1721.1/130953/Rehan_Jungsakulrujirek_Defining%20and%20Detecting%20Churn%20in%20Truckload%20Transportation.pdf?sequence=1&isAllowed=y
"Origin MarketStrength Indicator","Rating by the carrier of the level of business at the origin (1=Under Sold,2=Normal, 3=Over Sold, 4=Restricted)",gaming,"customer churn prediction",https://dspace.mit.edu/bitstream/handle/1721.1/130953/Rehan_Jungsakulrujirek_Defining%20and%20Detecting%20Churn%20in%20Truckload%20Transportation.pdf?sequence=1&isAllowed=y
"Destination MarketStrength Indicator","Rating by the carrier of the level of business at the destination (1=Under Sold,2=Normal, 3=Over Sold, 4=Restricted)",gaming,"customer churn prediction",https://dspace.mit.edu/bitstream/handle/1721.1/130953/Rehan_Jungsakulrujirek_Defining%20and%20Detecting%20Churn%20in%20Truckload%20Transportation.pdf?sequence=1&isAllowed=y
Profit,"The Profit of a shipment based on a monthly view of costs, prices, and networkand market impacts.  This view of contribution is used for longer term pricing asopposed to daily, dynamic acceptance.",gaming,"customer churn prediction",https://dspace.mit.edu/bitstream/handle/1721.1/130953/Rehan_Jungsakulrujirek_Defining%20and%20Detecting%20Churn%20in%20Truckload%20Transportation.pdf?sequence=1&isAllowed=y
LOH,"Length of Haul, in miles",gaming,"customer churn prediction",https://dspace.mit.edu/bitstream/handle/1721.1/130953/Rehan_Jungsakulrujirek_Defining%20and%20Detecting%20Churn%20in%20Truckload%20Transportation.pdf?sequence=1&isAllowed=y
"Characters Level","Highest level of character before and after the event",gaming,"customer churn prediction",https://arxiv.org/pdf/1909.10851
Itempurchasefrequency,"Number of purchases in store",gaming,"customer churn prediction",https://arxiv.org/pdf/1909.10851
"Game-playingtime band","Time band with the largest number of activity logs for two weeks",gaming,"customer churn prediction",https://arxiv.org/pdf/1909.10851
first_present_transaction_time,"Time shows the time gap between the first transaction and the following one.",gaming,"customer churn prediction",https://pdfs.semanticscholar.org/de8b/f11378cf64b9631508c26337f13630367365.pdf
device.id,"Unique device id assigned by smartphone manufacturer (used as unique user id)",gaming,"customer churn prediction",https://pdfs.semanticscholar.org/de8b/f11378cf64b9631508c26337f13630367365.pdf
event,"Type of this record (play or purchase)",gaming,"customer churn prediction",https://pdfs.semanticscholar.org/de8b/f11378cf64b9631508c26337f13630367365.pdf
score,"Score of the play (when event is play)",gaming,"customer churn prediction",https://pdfs.semanticscholar.org/de8b/f11378cf64b9631508c26337f13630367365.pdf
purchase.price,"Purchase price (when event is purchase)",gaming,"customer churn prediction",https://pdfs.semanticscholar.org/de8b/f11378cf64b9631508c26337f13630367365.pdf
id,"Unique user ID (log-in ID)",gaming,"customer churn prediction",https://pdfs.semanticscholar.org/de8b/f11378cf64b9631508c26337f13630367365.pdf
play.id,"Unique ID of the play",gaming,"customer churn prediction",https://pdfs.semanticscholar.org/de8b/f11378cf64b9631508c26337f13630367365.pdf
play.duration,"Duration of the play",gaming,"customer churn prediction",https://pdfs.semanticscholar.org/de8b/f11378cf64b9631508c26337f13630367365.pdf
win,"Team’s win or loss",gaming,"customer churn prediction",https://pdfs.semanticscholar.org/de8b/f11378cf64b9631508c26337f13630367365.pdf
points,"Points earned from the play (accumulated points are used to rank players and announce topleaders in a leaderboard)",gaming,"customer churn prediction",https://pdfs.semanticscholar.org/de8b/f11378cf64b9631508c26337f13630367365.pdf
activeDuration,"Time difference between the last play and the first play in OP, the same as the relative time ofthe last play",gaming,"customer churn prediction",https://pdfs.semanticscholar.org/de8b/f11378cf64b9631508c26337f13630367365.pdf
bestScore,"Best score earned in OP",gaming,"customer churn prediction",https://pdfs.semanticscholar.org/de8b/f11378cf64b9631508c26337f13630367365.pdf
bestScoreIndex,"Index of the best score normalized by play count",gaming,"customer churn prediction",https://pdfs.semanticscholar.org/de8b/f11378cf64b9631508c26337f13630367365.pdf
bestSubMeanCount,"Difference between best score and mean score normalized by play count",gaming,"customer churn prediction",https://pdfs.semanticscholar.org/de8b/f11378cf64b9631508c26337f13630367365.pdf
bestSubMeanRatio,"Ratio between the best score minus mean score and the mean score",gaming,"customer churn prediction",https://pdfs.semanticscholar.org/de8b/f11378cf64b9631508c26337f13630367365.pdf
consecutivePlayRatio,"is less than C, and the total number ofRatio between the count of consecutive plays, where ciadjacent plays (C: a game specific duration threshold to distinguish whether two adjacent playsare consecutive plays or not)(",gaming,"customer churn prediction",https://pdfs.semanticscholar.org/de8b/f11378cf64b9631508c26337f13630367365.pdf
meanScore,"Mean score earned in OP",gaming,"customer churn prediction",https://pdfs.semanticscholar.org/de8b/f11378cf64b9631508c26337f13630367365.pdf
playCount,"Total number of plays of u in OP",gaming,"customer churn prediction",https://pdfs.semanticscholar.org/de8b/f11378cf64b9631508c26337f13630367365.pdf
sdScore,"Standard deviation (SD) of the scores in OP",gaming,"customer churn prediction",https://pdfs.semanticscholar.org/de8b/f11378cf64b9631508c26337f13630367365.pdf
worstScore,"Worst score earned in OP",gaming,"customer churn prediction",https://pdfs.semanticscholar.org/de8b/f11378cf64b9631508c26337f13630367365.pdf
"kyc compliance","KYC compliance",retail,"customer churn prediction",http://www.ijmlc.org/vol7/634-P16.pdf
"recency value","The last time the customer has made a transaction",retail,"customer churn prediction",http://www.ijmlc.org/vol7/634-P16.pdf
"monetary values","The revenue that is gained from a customer during lifecycle",retail,"customer churn prediction",http://www.ijmlc.org/vol7/634-P16.pdf
"recency value","The last time the customer has made a transaction",retail,"customer churn prediction",https://wps-feb.ugent.be/Papers/wp_12_790.pdf
quarter_frequency,"Average number of transactions by quarter",retail,"customer churn prediction",https://wps-feb.ugent.be/Papers/wp_12_790.pdf
quarter_monetary,"Average amount of value spent by customers in each quarter",retail,"customer churn prediction",https://wps-feb.ugent.be/Papers/wp_12_790.pdf
"forward category succession dummy variable","Represents a succession of first products' categories purchased in chronological order",retail,"customer churn prediction",https://wps-feb.ugent.be/Papers/wp_12_790.pdf
"backward category succession dummy variable","represents a succession of first products' categories purchased in reverse chronological order",retail,"customer churn prediction",https://wps-feb.ugent.be/Papers/wp_12_790.pdf
number_products_purchased,"Number of products purchased by customer",retail,"customer churn prediction",https://www.academia.edu/download/60493022/362_Customer_Churn_Prediction_Using_Association_Rule_Mining20190905-47252-4myjzx.pdf
"mean purchased item","Average number of items purchased",retail,"customer churn prediction",https://www.academia.edu/download/60493022/362_Customer_Churn_Prediction_Using_Association_Rule_Mining20190905-47252-4myjzx.pdf
"sum of basket value","Total amount spent in one transaction",retail,"customer churn prediction",https://www.academia.edu/download/60493022/362_Customer_Churn_Prediction_Using_Association_Rule_Mining20190905-47252-4myjzx.pdf
"mean purchased value","Mean amount spent in one transaction",retail,"customer churn prediction",https://www.academia.edu/download/60493022/362_Customer_Churn_Prediction_Using_Association_Rule_Mining20190905-47252-4myjzx.pdf
"total discount","Sum of the discount given in each purchase",retail,"customer churn prediction",https://www.academia.edu/download/60493022/362_Customer_Churn_Prediction_Using_Association_Rule_Mining20190905-47252-4myjzx.pdf
"mean discount","Means Discount given for each basket",retail,"customer churn prediction",https://www.academia.edu/download/60493022/362_Customer_Churn_Prediction_Using_Association_Rule_Mining20190905-47252-4myjzx.pdf
"unique articles","Amount of unique articles purchases in each basket",retail,"customer churn prediction",https://www.academia.edu/download/60493022/362_Customer_Churn_Prediction_Using_Association_Rule_Mining20190905-47252-4myjzx.pdf
"unique categories","Number of different categories purchased in the basket",retail,"customer churn prediction",https://www.academia.edu/download/60493022/362_Customer_Churn_Prediction_Using_Association_Rule_Mining20190905-47252-4myjzx.pdf
retired_flag," is the client retired (1, 0)","banking financial service and insurance","customer churn prediction",https://www.kaggle.com/mathchi/churn-for-bank-customers
gender,"Gender of the client","banking financial service and insurance","customer churn prediction",https://www.kaggle.com/mathchi/churn-for-bank-customers
location,"Customer location including city and region","banking financial service and insurance","customer churn prediction",https://www.kaggle.com/mathchi/churn-for-bank-customers
income,"annual income of customer","banking financial service and insurance","customer churn prediction",https://www.kaggle.com/mathchi/churn-for-bank-customers
"credit score","A value between 0 and 800 indicating the riskiness of the borrower’s credit history.","banking financial service and insurance","customer churn prediction",https://www.kaggle.com/mathchi/churn-for-bank-customers
"customer value","How many products & services customers purchase and what kind of revenue that generates for the bank - past, current, and predicted for the future","banking financial service and insurance","customer churn prediction",https://www.kaggle.com/mathchi/churn-for-bank-customers
activity_flag,"is the client active (1, 0)","banking financial service and insurance","customer churn prediction",https://www.kaggle.com/mathchi/churn-for-bank-customers
customerid,"contains random values and has no effect on customer leaving the bank.","banking financial service and insurance","customer churn prediction",https://www.kaggle.com/mathchi/churn-for-bank-customers
surname,"the surname of a customer has no impact on their decision to leave the bank.","banking financial service and insurance","customer churn prediction",https://www.kaggle.com/mathchi/churn-for-bank-customers
hascrcard,"denotes whether or not a customer has a credit card. This column is also relevant, since people with a credit card are less likely to leave the bank.","banking financial service and insurance","customer churn prediction",https://www.kaggle.com/mathchi/churn-for-bank-customers
estimatedsalary,"as with balance, people with lower salaries are more likely to leave the bank compared to those with higher salaries.","banking financial service and insurance","customer churn prediction",https://www.kaggle.com/mathchi/churn-for-bank-customers
gender,"Gender of the client","banking financial service and insurance","customer churn prediction",https://www.researchgate.net/publication/306388481_Developing_a_prediction_model_for_customer_churn_from_electronic_banking_services_using_data_mining
income,"annual income of customer","banking financial service and insurance","customer churn prediction",https://www.researchgate.net/publication/306388481_Developing_a_prediction_model_for_customer_churn_from_electronic_banking_services_using_data_mining
education,"Users' education level","banking financial service and insurance","customer churn prediction",https://www.researchgate.net/publication/306388481_Developing_a_prediction_model_for_customer_churn_from_electronic_banking_services_using_data_mining
job,"unemployed/unskilled - resident/skilled employee/management/highly qualified employee","banking financial service and insurance","customer churn prediction",https://www.researchgate.net/publication/306388481_Developing_a_prediction_model_for_customer_churn_from_electronic_banking_services_using_data_mining
"relationship time with bank","Financial Variables","banking financial service and insurance","customer churn prediction",https://www.researchgate.net/publication/306388481_Developing_a_prediction_model_for_customer_churn_from_electronic_banking_services_using_data_mining
atm_transactions,"Number and amount of transactions made by customer through ATM","banking financial service and insurance","customer churn prediction",https://www.researchgate.net/publication/306388481_Developing_a_prediction_model_for_customer_churn_from_electronic_banking_services_using_data_mining
ussd_mbs_transactions,"Number and amount of transactions made by customer through USSD-based mobile banking","banking financial service and insurance","customer churn prediction",https://www.researchgate.net/publication/306388481_Developing_a_prediction_model_for_customer_churn_from_electronic_banking_services_using_data_mining
mbs_transactions,"Number and amount of transactions made by customer through mobile bank","banking financial service and insurance","customer churn prediction",https://www.researchgate.net/publication/306388481_Developing_a_prediction_model_for_customer_churn_from_electronic_banking_services_using_data_mining
telephone_transactions,"Number and amount of transactions made by customer through telephone bank","banking financial service and insurance","customer churn prediction",https://www.researchgate.net/publication/306388481_Developing_a_prediction_model_for_customer_churn_from_electronic_banking_services_using_data_mining
inb_transactions,"Number and amount of transactions made by customer through internet bank","banking financial service and insurance","customer churn prediction",https://www.researchgate.net/publication/306388481_Developing_a_prediction_model_for_customer_churn_from_electronic_banking_services_using_data_mining
"customer complaint","Number of complaint made by customer","banking financial service and insurance","customer churn prediction",https://www.researchgate.net/publication/306388481_Developing_a_prediction_model_for_customer_churn_from_electronic_banking_services_using_data_mining
"length of customer association","Number of years the customer is associated with a bank","banking financial service and insurance","customer churn prediction",https://www.researchgate.net/publication/306388481_Developing_a_prediction_model_for_customer_churn_from_electronic_banking_services_using_data_mining
marital_status," is the client married (Yes, No)","banking financial service and insurance","customer churn prediction",http://www.naturalspublishing.com/files/published/yt9r868jnrv116.pdf
gender,"Gender of the client","banking financial service and insurance","customer churn prediction",http://www.naturalspublishing.com/files/published/yt9r868jnrv116.pdf
income,"annual income of customer","banking financial service and insurance","customer churn prediction",http://www.naturalspublishing.com/files/published/yt9r868jnrv116.pdf
property_saving_insurance,"real estate/ building society savings agreement/life insurance/no property","banking financial service and insurance","customer churn prediction",http://www.naturalspublishing.com/files/published/yt9r868jnrv116.pdf
"deposits with bank","Money placed into the bank","banking financial service and insurance","customer churn prediction",http://www.naturalspublishing.com/files/published/yt9r868jnrv116.pdf
"current loan amount","This is the loan amount that was either completely paid off, or the amount that was defaulted.","banking financial service and insurance","customer churn prediction",http://www.naturalspublishing.com/files/published/yt9r868jnrv116.pdf
atm_transactions,"Number and amount of transactions made by customer through ATM","banking financial service and insurance","customer churn prediction",http://www.naturalspublishing.com/files/published/yt9r868jnrv116.pdf
mbs_transactions,"Number and amount of transactions made by customer through mobile bank","banking financial service and insurance","customer churn prediction",http://www.naturalspublishing.com/files/published/yt9r868jnrv116.pdf
inb_transactions,"Number and amount of transactions made by customer through internet bank","banking financial service and insurance","customer churn prediction",http://www.naturalspublishing.com/files/published/yt9r868jnrv116.pdf
"branch debit and credit transactions","Branch Debit and Credit transactions","banking financial service and insurance","customer churn prediction",http://www.naturalspublishing.com/files/published/yt9r868jnrv116.pdf
"atm transactions","ATM transactions","banking financial service and insurance","customer churn prediction",http://www.naturalspublishing.com/files/published/yt9r868jnrv116.pdf
"pos transactions","Point of sale transactions","banking financial service and insurance","customer churn prediction",http://www.naturalspublishing.com/files/published/yt9r868jnrv116.pdf
"e-com transactions","E-COM transactions","banking financial service and insurance","customer churn prediction",http://www.naturalspublishing.com/files/published/yt9r868jnrv116.pdf
"gcc transactions","Green Channel Counter transactions","banking financial service and insurance","customer churn prediction",http://www.naturalspublishing.com/files/published/yt9r868jnrv116.pdf
"inb transactions","Internet Banking Transactions","banking financial service and insurance","customer churn prediction",http://www.naturalspublishing.com/files/published/yt9r868jnrv116.pdf
"mbs transactions","Mobile banking services transactions","banking financial service and insurance","customer churn prediction",http://www.naturalspublishing.com/files/published/yt9r868jnrv116.pdf
"existing loans","Number and amount of existing loans of the customer","banking financial service and insurance","customer churn prediction",http://www.naturalspublishing.com/files/published/yt9r868jnrv116.pdf
deposits,"Amount deposit by Customer","banking financial service and insurance","customer churn prediction",http://www.naturalspublishing.com/files/published/yt9r868jnrv116.pdf
"customer vintage","Customer Vintage","banking financial service and insurance","customer churn prediction",http://www.naturalspublishing.com/files/published/yt9r868jnrv116.pdf
"joint ventures & investments","Life insurance, General Insurance, Mutual funds, etc.","banking financial service and insurance","customer churn prediction",http://www.naturalspublishing.com/files/published/yt9r868jnrv116.pdf
"kyc compliance","KYC compliance","banking financial service and insurance","customer churn prediction",http://www.naturalspublishing.com/files/published/yt9r868jnrv116.pdf
"usage of inb services","purpose of using Internet banking services","banking financial service and insurance","customer churn prediction",http://www.naturalspublishing.com/files/published/yt9r868jnrv116.pdf
retired_flag," is the client retired (1, 0)",telecommunication,"customer churn prediction",https://www.kaggle.com/radmirzosimov/telecom-users-dataset
marital_status," is the client married (Yes, No)",telecommunication,"customer churn prediction",https://www.kaggle.com/radmirzosimov/telecom-users-dataset
tenure,"Tenure of credit card service for user",telecommunication,"customer churn prediction",https://www.kaggle.com/radmirzosimov/telecom-users-dataset
internetservice," client's Internet service provider (DSL, Fiber optic, No)",telecommunication,"customer churn prediction",https://www.kaggle.com/radmirzosimov/telecom-users-dataset
contract," type of customer contract (Month to month, one year, two year",telecommunication,"customer churn prediction",https://www.kaggle.com/radmirzosimov/telecom-users-dataset
paperlessbilling," whether the client uses paperless billing (Yes, No)",telecommunication,"customer churn prediction",https://www.kaggle.com/radmirzosimov/telecom-users-dataset
onlinesecurity,"Is online security service connected (Yes, No, No internet service)",telecommunication,"customer churn prediction",https://www.kaggle.com/radmirzosimov/telecom-users-dataset
totalcharges,"total amount that the client paid for the services for the entire time",telecommunication,"customer churn prediction",https://www.kaggle.com/radmirzosimov/telecom-users-dataset
techsupport,"Is the technical support service connected (Yes, No, No internet service)",telecommunication,"customer churn prediction",https://www.kaggle.com/radmirzosimov/telecom-users-dataset
paymentmethod,"payment method (Electronic check, Mailed check, Bank transfer (automatic), Credit card (automatic))",telecommunication,"customer churn prediction",https://www.kaggle.com/radmirzosimov/telecom-users-dataset
monthlycharges,"current monthly payment",telecommunication,"customer churn prediction",https://www.kaggle.com/radmirzosimov/telecom-users-dataset
gender,"Gender of the client",telecommunication,"customer churn prediction",https://www.kaggle.com/radmirzosimov/telecom-users-dataset
"international plan","International call usage",telecommunication,"customer churn prediction",https://www.researchgate.net/publication/282981765_Customer_churn_prediction_in_telecommunication
"total day minutes","Daily total talk time",telecommunication,"customer churn prediction",https://www.researchgate.net/publication/282981765_Customer_churn_prediction_in_telecommunication
"number customer service calls","Number of call to customer service",telecommunication,"customer churn prediction",https://www.researchgate.net/publication/282981765_Customer_churn_prediction_in_telecommunication
"voice mail plan","Voice mail usage",telecommunication,"customer churn prediction",https://www.researchgate.net/publication/282981765_Customer_churn_prediction_in_telecommunication
"total eve minutes","Total talk time in evening",telecommunication,"customer churn prediction",https://www.researchgate.net/publication/282981765_Customer_churn_prediction_in_telecommunication
state,"Living place",telecommunication,"customer churn prediction",https://www.researchgate.net/publication/282981765_Customer_churn_prediction_in_telecommunication
"total day charge","Daily Total spent credits",telecommunication,"customer churn prediction",https://www.researchgate.net/publication/282981765_Customer_churn_prediction_in_telecommunication
"number vmail messages","Number of voice messages",telecommunication,"customer churn prediction",https://www.researchgate.net/publication/282981765_Customer_churn_prediction_in_telecommunication
"total intl calls","Total number of international call",telecommunication,"customer churn prediction",https://www.researchgate.net/publication/282981765_Customer_churn_prediction_in_telecommunication
"total intl charge","Total spent credits of international calls ",telecommunication,"customer churn prediction",https://www.researchgate.net/publication/282981765_Customer_churn_prediction_in_telecommunication
contract," type of customer contract (Month to month, one year, two year",telecommunication,"customer churn prediction",https://arxiv.org/pdf/1904.00690.pdf
gender,"Gender of the client",telecommunication,"customer churn prediction",https://arxiv.org/pdf/1904.00690.pdf
"mobile imei information","Contains the brand, model, type of the mobile phone and if it's dual or mono SIM device",telecommunication,"customer churn prediction",https://arxiv.org/pdf/1904.00690.pdf
"towers and complaints database","Information of action location is represented as digits. Mapping these digits with towers' database provides the location of this transaction, giving the longitude and latitude, sub-area, area, city, and state. All complaints submitted and statistics inquiries
related to coverage, problems in offers and packages, and any problem related to the
telecom business",telecommunication,"customer churn prediction",https://arxiv.org/pdf/1904.00690.pdf
"network logs data","Contains the internal sessions related to internet, calls, and SMS for each transaction in Telecom operator, like the time needed to open a session for the internet and call ending status. It could indicate if the session dropped due to an error in the internal network",telecommunication,"customer churn prediction",https://arxiv.org/pdf/1904.00690.pdf
"customer data","Contains all data related to customer's services and contract information as well as date of birth, gender, location",telecommunication,"customer churn prediction",https://arxiv.org/pdf/1904.00690.pdf
"call details records(cdr)","Contain all charging information about calls, SMS, MMS, and internet transaction made by customers.",telecommunication,"customer churn prediction",https://arxiv.org/pdf/1904.00690.pdf
